{"$schema":"https://json-schema.org/draft/2020-12/schema","$id":"qwen_passrate_input.v1","type":"object","required":["candidate_id","revision_id","question","synthesis_result"],"properties":{"candidate_id":{"type":"string","minLength":1},"revision_id":{"type":"string","minLength":1},"question":{"type":"string","minLength":1},"synthesis_result":{"type":"object"}},"additionalProperties":false}
