{"candidate_id":"passrate-smoke-1","revision_id":"passrate-smoke-rev-1","question":"How is the reorder point calculated according to the supplied planning rule?","synthesis_result":{"revision_id":"passrate-smoke-rev-1","result_id":"synthetic-answer-result","status":"COMPLETED","decision":"SYNTHESIZED","max_tokens":32768,"answer_type":"text","reference_answer":"According to the supplied planning rule, the reorder point is calculated as lead-time demand plus safety stock.","reference_answer_hash":"310d37ecd844f9a4c35f5f1ecb595a2d5ce031eed9cdf4e307ff76d3c47384f6","citations":["synthetic-handbook@rev-1#chunk-1"]}}
